Title,Description,Author,Link,Image
"Manu Rios on Fame, Feeling Exposed and Spending More Time in Los Angeles: “It’s in the Works”","Manu Rios made his way to Mexico last month to attend the Platino Awards, held for the third time in 11 years at the Gran Tlachco Theater at Xcaret Park in Riviera Maya. Rios, a breakout star from the steamy Netflix series Elite, was among a long list of boldfaced names to make the trek […]",Chris Gardner,https://www.hollywoodreporter.com/movies/movie-news/manu-rios-interview-new-series-breathless-1235889438/,https://www.hollywoodreporter.com/wp-content/uploads/2024/05/GettyImages-2149491206-e1714720573658.jpg?crop=0px%2C0px%2C2667px%2C1492px&resize=450%2C253
Matteo Garrone’s ‘Io Capitano’ Wins Italian Film Awards,"Matteo Garrone’s refugee drama Io Capitano, an Oscar nominee this year for Italy in the best international feature category, was the big winner of this year’s 2024 David Di Donatello Awards, Italy’s equivalent to the Oscars, winning best film and director for Garrone. Io Capitano also picked up prizes for best cinematography, editing, sound, and visual effects. Paola Cortellesi’s There’s […]",Scott Roxborough,https://www.hollywoodreporter.com/movies/movie-news/2024-italian-film-award-winners-1235889566/,https://www.hollywoodreporter.com/wp-content/uploads/2023/08/IO-CAPITANO-Actor-Seydou-Sarr-Credits-Greta-De-Lazzaris.jpg?w=450&h=253&crop=1
‘My Old Ass’ to Open Toronto’s Inside Out Film Festival,"Inside Out, Toronto’s LGBTQ+ film festival, has revealed the full program lineup for its 34th edition, including its opening night selection, My Old Ass, from Canadian director Megan Park. My Old Ass, which debuted at the Sundance Film Festival where is was acquired by Amazon MGM, follows an 18 year-old Elliott (Maisy Stella) who meets […]",Mia Galuppo,https://www.hollywoodreporter.com/movies/movie-news/my-old-ass-toronto-inside-out-film-festival-1235889898/,https://www.hollywoodreporter.com/wp-content/uploads/2024/05/My-Old-Ass-and-Sisters-Split-Publicity-H-2024.jpg?w=450&h=253&crop=1
‘The Maze Runner’ Reboot in the Works with ‘Transcendence’ Scribe Jack Paglen in Talks to Write (Exclusive),"The Maze Runner is back at the starting line. 20th Century Studios is rebooting the sci-fi action adventure franchise, which ran as a trilogy from 2014 to 2018. The Disney arm is in negotiations to tap Jack Paglen, perhaps best known for writing the Johnny Depp-starring sci-fi movie Transcendence, to pen the script for a […]",Borys Kit,https://www.hollywoodreporter.com/movies/movie-news/the-maze-runner-reboot-in-the-works-1235889793/,https://www.hollywoodreporter.com/wp-content/uploads/2024/05/Jack-Paglen-and-The-Maze-Runner-NEW-Split-Getty-H-2024.jpg?w=450&h=253&crop=1
Matthias Glasner’s ‘Dying’ Wins German Film Awards,"Matthias Glasner’s epic dysfunctional family drama Dying has won the top prize for best film at the 2024 German Film Awards, the Lolas. Dying was one of the critical favorites at this year’s Berlin Film Festival, where Glasner won the Silver Bear for best screenplay. The film stars Lars Eidinger as a classical conductor with an extremely dysfunctional family. In […]",Scott Roxborough,https://www.hollywoodreporter.com/movies/movie-news/2024-german-film-award-winners-1235889560/,https://www.hollywoodreporter.com/wp-content/uploads/2024/02/Sterben-Lars-Eidinger.jpeg?w=450&h=253&crop=1
Chris Pine Says Getting ‘Princess Diaries 2’ Role Was “Absolutely Earth-Shattering”,"In a preview from his conversation with Willie Geist for Sunday TODAY, Chris Pine looked back at how much his role as Anne Hathaway’s love interest in The Princess Diaries 2: Royal Engagement impacted his career. Pine recalled the exact moment he got the life-changing call saying he had been cast as Nicholas Devereaux. He […]",Tatiana Tenreyro,https://www.hollywoodreporter.com/movies/movie-news/chris-pine-life-changing-role-princess-diaries-2-1235889885/,https://www.hollywoodreporter.com/wp-content/uploads/2024/05/MCDPRDI_EC057-H-2024.jpg?w=450&h=253&crop=1
‘The Idea of You’ Team on Creating a Pop Star in Nicholas Galitzine: “He Just Made the Songs Come Alive”,"In 2022, Nicholas Galitzine was on the main stage of “Coachella”, flanked by bandmates Jaiden Anthony, Raymond Cham Jr., Vik White, and Dakota Adan. Surrounding them were 5,000 screaming fans, chanting at the top of their lungs, “August Moon! August Moon! August Moon!” For most of the guys, who are professional dancers, this was somewhat […]",Cat Cardenas,https://www.hollywoodreporter.com/movies/movie-features/nicholas-galitizine-the-idea-of-you-music-boy-band-1235889657/,https://www.hollywoodreporter.com/wp-content/uploads/2024/05/IDEA_2023_UT_221122_WETALI_00152RC_3000-EMBED-2024.jpg?w=450&h=253&crop=1
Cannes Film Festival: Kevin Costner Will Guest on THR’s ‘Awards Chatter’ Podcast Live From the Palais,"The Hollywood Reporter and Campari are pleased to invite attendees of the upcoming Cannes Film Festival to a very special event at the fest: a live in-depth interview with Kevin Costner, the legendary actor and Oscar-winning filmmaker, followed by a cocktail reception. On Sunday, May 19, at 11:30am Cannes time, Costner will sit down with […]",Scott Feinberg,https://www.hollywoodreporter.com/movies/movie-news/cannes-film-festival-kevin-costner-awards-chatter-podcast-1235877110/,https://www.hollywoodreporter.com/wp-content/uploads/2024/04/KC.jpg?w=450&h=253&crop=1
"‘Tarot’ Star Jacob Batalon on Horoscopes, ‘Spider-Man 4’ Rumors and Wanting to Show His Range","Before he returns to the role of Spider-Man’s best friend, “Guy in the Chair” and emergency sorcerer, Jacob Batalon is deepening his relationship with Sony Pictures. Today, Batalon is back on the big screen in the studio’s supernatural horror film, Tarot. Written and directed by Anna Halberg and Spenser Cohen, Tarot chronicles seven college friends […]",Brian Davids,https://www.hollywoodreporter.com/movies/movie-features/tarot-star-jacob-batalon-spider-man-1235889263/,https://www.hollywoodreporter.com/wp-content/uploads/2024/05/GettyImages-1410365876-copy.jpg?w=450&h=253&crop=1
How Andy Serkis and Matt Reeves Supported ‘Kingdom of the Planet of the Apes’,"Andy Serkis and Matt Reeves, who collaborated on 2014’s Dawn of the Planet of the Apes and 2017’s War for the Planet of the Apes, may not lead the new adaptation, but still played a role in Kingdom of the Planet of the Apes. At the film’s Los Angeles premiere on Thursday, Kingdom director Wes […]",Kirsten Chuba,https://www.hollywoodreporter.com/movies/movie-news/andy-serkis-matt-reeves-kingdom-of-the-planet-of-the-apes-1235889620/,https://www.hollywoodreporter.com/wp-content/uploads/2024/05/GettyImages-2150173833.jpg?crop=0px%2C15px%2C5048px%2C2825px&resize=450%2C253
"‘CODA’ Filmmaker Siân Heder to Direct Paramount’s ‘Tomorrow, and Tomorrow, and Tomorrow’","Siân Heder, whose CODA won the Oscar for best picture in 2022, has signed on to direct Tomorrow, and Tomorrow, and Tomorrow, Paramount Pictures’ adaptation of the best selling novel by Gabrielle Zevin. Marty Bowen, Wyck Godfrey and Isaac Klausner will produce via their book-friendly Temple Hill banner. Described as a modern love story that spans three […]",Borys Kit,https://www.hollywoodreporter.com/movies/movie-news/tomorrow-and-tomorrow-and-tomorrow-movie-1235889653/,https://www.hollywoodreporter.com/wp-content/uploads/2024/05/Sian-Heder-WIF-Oscars-Nominees-Party-GettyImages-2069868022-H-2024.jpg?w=450&h=253&crop=1
Apple Releases May the 4th ‘Star Wars’ Ad Starring 172 Real-Life Fans,"Apple and Disney have joined forces, so to speak, for a Star Wars-themed ad. The clever commercial (below) is timed for “Star Wars Day,” May the 4th, and touts iPhone 15’s “Precision Finding for Find My Friends” feature. The setup: A Star Wars fan cosplaying as a Mandalorian (played by real-life fan Owen Jardiniano) journeys […]",James Hibberd,https://www.hollywoodreporter.com/movies/movie-news/apple-star-wars-ad-may-the-4th-1235889651/,https://www.hollywoodreporter.com/wp-content/uploads/2024/05/Screen-Shot-2024-05-03-at-11.22.36-AM-2.png?w=450&h=253&crop=1
"Jamie Bell, Olivia Cooke Join ‘Takes One To Know One’ From ‘Nocturnal’ Director","Olivia Cooke and Jamie Bell have signed on to star in Takes One To Know One, a contemporary romance from Italian director Nathalie Biancheri (Nocturnal) based on Brooke Baker’s 2022 Black List script. The Ready Player One and House of the Dragon actress and the All of Us Strangers and Rocketman actor will play Eleanor […]",Scott Roxborough,https://www.hollywoodreporter.com/movies/movie-news/jamie-bell-olivia-cooke-romance-takes-one-to-know-one-1235889568/,https://www.hollywoodreporter.com/wp-content/uploads/2024/05/Olivia-Cooke-and-Jamie-Bell-Split-Getty-H-2024.jpg?w=450&h=253&crop=1
Why ‘The Idea of You’ Strays From Book’s Ending,"[This story contains spoilers to the The Idea of You film on Prime Video.] The Idea of You starts like any other romance movie: A boy and girl meet, fall in love, and maybe have a swoon-worthy ending. But what happens when the girl is a 40-year-old woman, the boy is a 24-year-old boy band […]",Lexy Perez,https://www.hollywoodreporter.com/movies/movie-features/the-idea-of-you-director-michael-showalter-interview-1235887375/,https://www.hollywoodreporter.com/wp-content/uploads/2024/05/2024_05-Idea_of_You-01-H-2024.jpg?w=450&h=253&crop=1
Jerry Seinfeld’s ‘Unfrosted’ Divides Critics: “One of Decade’s Worst Movies”,"Jerry Seinfeld is having an odd time lately. Fans and critics really enjoyed his appearance in HBO’s Curb Your Enthusiasm series finale — which creator Larry David used to both comment on, and improve upon, the much-maligned Seinfeld closer. But this week, the 70-year-old comedy legend was slammed on social media for a recent interview […]",James Hibberd,https://www.hollywoodreporter.com/movies/movie-news/jerry-seinfeld-unfrosted-reviews-netflix-1235889540/,https://www.hollywoodreporter.com/wp-content/uploads/2024/05/MCDUNTH_ZX0632.jpg?w=450&h=253&crop=1
Box Office: Ryan Gosling’s ‘The Fall Guy’ Lands $3.15M in Previews,The Ryan Gosling fronted action comedy The Fall Guy has landed $3.15 million over Thursday previews at the domestic box office. The Univeral title — inspired by the 1980s TV show of the same name starring Lee Majors — is tracking to open in the $30 million to $35 million range. Its net budget is […],Mia Galuppo,https://www.hollywoodreporter.com/movies/movie-news/the-fall-guy-box-office-ryan-gosling-1235889576/,https://www.hollywoodreporter.com/wp-content/uploads/2024/04/2565_FP4_00024-copy.jpg?w=450&h=253&crop=1
"‘Alpha,’ New Film From ‘Titane’ Director, Heading to Cannes Market","Alpha, the new, still-top-secret film from Titane director Julia Ducournau will be one of the hot projects being shopped to buyers at this year’s Cannes film market. About Elly and Paterson actress Golshifteh Farahani and French star Tahar Rahim (A Prophet, The Mauritanian) are set to star in the feature, the plot details of which […]",Scott Roxborough,https://www.hollywoodreporter.com/movies/movie-news/titane-director-new-film-alpha-cannes-market-1235889520/,https://www.hollywoodreporter.com/wp-content/uploads/2024/05/GettyImages-1493858928.jpg?crop=0px%2C64px%2C2997px%2C1679px&resize=450%2C253
"Andrew Garfield, Claire Foy to Star in Film Adaptation of Enid Blyton’s ‘The Magic Faraway Tree’","Andrew Garfield and Claire Foy will lead the film adaptation of Enid Blyton’s children’s classic The Magic Faraway Tree. The story from the author, based on her The Faraway Tree series of novels for children, follows Polly and Tim and their children Beth, Joe and Fran — a modern family who find themselves forced to […]",Lily Ford,https://www.hollywoodreporter.com/movies/movie-news/andrew-garfield-claire-foy-the-magic-faraway-tree-film-1235889477/,https://www.hollywoodreporter.com/wp-content/uploads/2024/05/thumbnail_image001.jpg?w=450&h=253&crop=1
"Israeli-Palestinian Film Collective, Ukraine War Archive to Get Sheffield DocFest Spotlight","The Sheffield DocFest 2024 will shine the spotlight on a collective of Palestinian and Israeli filmmakers, the Ukraine War Archive project, and more, as organizers on Friday unveiled that the theme for the 31st edition of the English festival will be “Reflections on Realities.” The event, taking place June 12-17, will offer a special program of […]",Georg Szalai,https://www.hollywoodreporter.com/movies/movie-news/palestinian-israeli-film-collective-ukraine-war-sheffield-docfest-1235889455/,https://www.hollywoodreporter.com/wp-content/uploads/2024/05/No-Other-Land.jpg?w=450&h=253&crop=1
Far East Film Festival: Mitsuhiro Mihara’s Family Drama ‘Takano Tofu’ Wins Top Prize,"On a big night for Japan, Mitsuhiro Mihara’s Takano Tofu took home the top prize at the 26th Far East Film Festival (FEFF), which concluded on Thursday night in the northern Italian city of Udine. The family drama, which stars Tatsuya Fuji and Kumiko Aso as a father and daughter who run a tofu store […]",Abid Rahman,https://www.hollywoodreporter.com/movies/movie-news/far-east-film-festival-2024-winners-list-1235889383/,https://www.hollywoodreporter.com/wp-content/uploads/2024/05/GMnD4zLXsAAFMNr.jpg?w=450&h=253&crop=1
Ryan Gosling Would Like to Redo ‘La La Land’ Scene Because of His “La La Hand” on the Movie Poster,"Ryan Gosling has revealed a moment in 2016’s La La Land that still “haunts” him to this day. In an interview for WSJ Magazine‘s “The One” video series, the actor admitted that if he could, he would reshoot the film’s dance sequence with co-star Emma Stone that was featured on the movie’s promo poster. As […]",Carly Thomas,https://www.hollywoodreporter.com/movies/movie-news/ryan-gosling-la-la-land-dance-sequence-haunts-him-1235889396/,https://www.hollywoodreporter.com/wp-content/uploads/2023/02/MCDLALA_EC031-H-2023.jpg?w=450&h=253&crop=1
‘Unfrosted’ Review: Melissa McCarthy in Jerry Seinfeld’s Lightweight but Satisfying Pop-Tarts Origin Story,"Directing a feature for the first time, the sitcom legend also stars in the Netflix movie as a cereal company executive involved in the race to create a toaster pastry.",Sheri Linden,https://www.hollywoodreporter.com/movies/movie-reviews/unfrosted-review-melissa-mccarthy-jerry-seinfeld-netflix-1235886194/,https://www.hollywoodreporter.com/wp-content/uploads/2024/01/Unfrosted-Netflix.jpg?w=450&h=253&crop=1
Naomi Osaka Shares Her Own Tennis Moves Set to ‘Challengers’ Score,"Tennis star Naomi Osaka offered her response to Luca Guadagnino’s buzzy tennis movie Challengers on Thursday, sharing her own moves on the court set to the movie’s viral techno score. On TikTok, Osaka posted a video of herself moving through a tennis serve and twirling her racket with her fingers after writing, “Me after watching […]",Zoe G Phillips,https://www.hollywoodreporter.com/movies/movie-news/naomi-osaka-challengers-inspiration-1235889346/,https://www.hollywoodreporter.com/wp-content/uploads/2024/05/NaomiOsakaGettyImages-2150135041.jpg?w=450&h=253&crop=1
Alfred Molina Fights Tears Recalling His Father Rejecting His Acting Career: “I Did Disappoint My Dad”,"Alfred Molina struggled to hold back tears as he shared a story about his late father, who never vocally expressed his support for his acting career. The actor opened up about his relationship with his father while looking back at his acting career during a recent interview with Vanity Fair. The Spider-Man 2 star recalled […]",Carly Thomas,https://www.hollywoodreporter.com/movies/movie-news/alfred-molina-emotional-father-rejected-acting-career-1235889235/,https://www.hollywoodreporter.com/wp-content/uploads/2024/05/Alfred-Molina-Opening-Night-Carpet-GettyImages-2150074208-H-2024.jpg?w=450&h=253&crop=1
Ryan Gosling on Why He Doesn’t Take on “Dark” Roles Anymore: “Family in Mind First”,Ryan Gosling takes a lot into consideration before choosing his next movie role. The Oscar-nominated actor recently opened up to The Wall Street Journal about his decision to avoid taking on darker projects so that he can be present with his family. “I don’t really take roles that are going to put me in some […],Carly Thomas,https://www.hollywoodreporter.com/movies/movie-news/ryan-gosling-doesnt-take-dark-movie-roles-family-1235889084/,https://www.hollywoodreporter.com/wp-content/uploads/2024/05/GettyImages-2150913647-copy.jpg?w=450&h=253&crop=1
Rosamund Pike Joins ‘Now You See Me 3’,"Even after playing a sorceress on Wheel of Time, Rosamund Pike still has a few more tricks up her sleeve. The actor is the latest to join the cast of Lionsgate’s Now You See Me 3, the upcoming installment of the magic heist franchise. She’s among a number of newcomers to the series, following Justice […]",Aaron Couch,https://www.hollywoodreporter.com/movies/movie-news/rosamund-pike-now-you-see-me-3-1235889195/,https://www.hollywoodreporter.com/wp-content/uploads/2024/05/Rosamund-Pike-Headshot-Announcement-Publicity-H-2024.jpg?w=450&h=253&crop=1
Anya Taylor-Joy Wears Transparent Gold Dress With Giant Spikes to ‘Furiosa’ Premiere,"Look, but definitely do not touch. Anya Taylor-Joy rocked a dramatic transparent gold dress covered in giant spikes at the Furiosa premiere in Sydney, Australia, on Thursday. The 28-year-old star took to the red carpet in a gold and silver minidress and headpiece with arrow-like spikes — similar to the gold, metallic color scheme that’s […]",James Hibberd,https://www.hollywoodreporter.com/movies/movie-news/anya-taylor-joy-transparent-gold-dress-spike-furiosa-premiere-1235889170/,https://www.hollywoodreporter.com/wp-content/uploads/2024/05/GettyImages-2151088695-H-2024.jpg?w=450&h=253&crop=1
"Janelle Monáe Joins Universal Musical From Michel Gondry, Pharrell Williams","The high-profile cast for Universal Pictures’ forthcoming musical from Michel Gondry and Pharrell Williams has just been kicked up an octave with the addition of Janelle Monáe. Monáe has signed on to join the cast of the coming-of-age period feature that is currently untitled. The film’s previously confirmed castmembers include Kelvin Harrison Jr., Halle Bailey, […]",Ryan Gajewski,https://www.hollywoodreporter.com/movies/movie-news/janelle-monae-universal-musical-michel-gondry-pharrell-williams-1235889078/,https://www.hollywoodreporter.com/wp-content/uploads/2024/05/PDXN_24_001_JM_GRAMMYS3705-1_pp-copy.jpg?w=450&h=253&crop=1
A24 Scoops Up Adam Wingard Action Movie ‘Onslaught’,"It looks like another Godzilla x Kong movie will have to wait. Adam Wingard, who directed the last two of the hit Legendary MonsterVerse movies, has lined up a new feature project that will go before any new creature feature. A24, the one-time scrappy indie that is rapidly scaling up, came out on top of […]",Borys Kit,https://www.hollywoodreporter.com/movies/movie-news/a24-scoops-up-adam-wingard-onslaught-1235889025/,https://www.hollywoodreporter.com/wp-content/uploads/2024/05/GettyImages-2113392002-copy.jpg?w=450&h=253&crop=1
‘Fantastic Four’ Enlists Paul Walter Hauser,"Paul Walter Hauser will be making his Marvel debut with a role in The Fantastic Four, The Hollywood Reporter has confirmed. No character details were available, but he joins a cast that includes Pedro Pascal as Reed Richards/Mr. Fantastic, Vanessa Kirby as Sue Storm/The Invisible Woman, Joseph Quinn as Johnny Storm/The Human Torch, Ebon Moss-Bachrach […]",Aaron Couch,https://www.hollywoodreporter.com/movies/movie-news/fantastic-four-casts-paul-walter-hauser-1235889021/,https://www.hollywoodreporter.com/wp-content/uploads/2024/05/Paul-Walter-Hauser-Orion-and-the-Dark-Premiere-GettyImages-1966575024-H-2024.jpg?w=450&h=253&crop=1
‘Fast X’ Director Louis Leterrier to Helm ‘11817’ Sci-Fi Horror Pic,"Louis Leterrier the director of Fast X and several Transporter action movies has been tapped to direct and produce the sci-fi horror film 11817, based on a script by Matthew Robinson. The genre pic produced by Leterrier’s Carrousel Studios, Rocket Science, Thank You Studios, Chernin Entertainment and 3 Arts Entertainment is now casting. Rocket Science will fully finance, […]",Etan Vlessing,https://www.hollywoodreporter.com/movies/movie-news/fast-x-director-louis-leterrier-helm-11817-1235888876/,https://www.hollywoodreporter.com/wp-content/uploads/2024/05/GettyImages-1561350930-copy.jpg?w=450&h=253&crop=1
"Jan Haag, Founder of the AFI’s Directing Workshop for Women, Dies at 90","Jan Haag, who a half-century ago founded the landmark Directing Workshop for Women at the American Film Institute, has died. She was 90. The remarkable Haag, who also was an actress, painter, poet, novelist, playwright, writer of travel stories and creator of needlepoint canvases, some of which required hundreds of hours to complete, died Monday […]",Mike Barnes,https://www.hollywoodreporter.com/movies/movie-news/jan-haag-dead-afi-directing-workshop-women-1235888865/,https://www.hollywoodreporter.com/wp-content/uploads/2024/05/Jan-Haag.jpg?w=450&h=253&crop=1
Kevin Durand Joins Liam Neeson in ‘Naked Gun’ Remake (Exclusive),"After donning ape fur for his upcoming Kingdom of the Planet of the Apes, Kevin Durand is now getting Naked. The actor, who is also currently on screens with horror movie Abigail, has joined Liam Neeson in Paramount Pictures’ untitled remake of Naked Gun, based on the crime spoof comedies that were released in the late […]",Borys Kit,https://www.hollywoodreporter.com/movies/movie-news/kevin-durand-joins-liam-neeson-in-naked-gun-1235888748/,https://www.hollywoodreporter.com/wp-content/uploads/2024/05/GettyImages-2149570229-H-2024.jpg?w=450&h=253&crop=1
"Nick Jonas, Paul Rudd to Star in New Movie from ‘Sing Street’ Director Jon Carney","Nick Jonas and Paul Rudd are set to star in the latest movie from Jon Carney, the director behind Once and Sing Street. The project, which was written by Carney and Peter McDonald, will follow Rudd as a wedding singer and Jonas as a flagging pop star who come together to write a song to […]",Mia Galuppo,https://www.hollywoodreporter.com/movies/movie-news/nick-jonas-paul-rudd-power-ballad-1235888736/,https://www.hollywoodreporter.com/wp-content/uploads/2024/05/Paul-Rudd-and-Nick-Jonas-Split-Getty-H-2024.jpg?w=450&h=253&crop=1
Jonathan Nolan Says He’d “Absolutely” Make More Batman Movies,"The Dark Knight trilogy is considered, by some, the best superhero franchise ever made. The trio of films directed by Christopher Nolan, released between 2005 and 2012, are revered for their grown-up, adult crime drama vibe and cinematic scope. Now Nolan’s brother and franchise co-writer Jonathan Nolan says he’d be down to return to the […]",James Hibberd,https://www.hollywoodreporter.com/movies/movie-news/jonathan-nolan-batman-franchise-1235888653/,https://www.hollywoodreporter.com/wp-content/uploads/2020/12/The-Dark-Knight-Publicity-H-2020-1607819861.jpg?w=450&h=253&crop=1
Meryl Streep Set to Receive Cannes Honorary Palme D’Or,"Meryl Streep is set to receive an honorary Palme d’Or at the opening ceremony of the Cannes Film Festival on May 14, organizers said Thursday. The Hollywood star — who earned the best actress award at Cannes in 1989 for her performance in Fred Schepsi’s Evil Angels — will help kick off the 77th edition […]",Etan Vlessing,https://www.hollywoodreporter.com/movies/movie-news/meryl-streep-cannes-honorary-palme-dor-1235888623/,https://www.hollywoodreporter.com/wp-content/uploads/2024/05/Meryl-Streep-SAG-Red-Carpet-GettyImages-2037037990-H-2024.jpg?w=450&h=253&crop=1
"Kristen Stewart, Oscar Isaac to Star in Vampire Thriller ‘Flesh of the Gods’ for ‘Mandy’ Filmmaker","Kristen Stewart and Oscar Isaac are set to star in Flesh of the Gods, a vampire thriller to be directed by Panos Cosmatos, the filmmaker best known for his hallucinatory 2018 horror movie Mandy. Adam McKay is producing this new feature along with Betsy Koch via the duo’s Hyperobject Industries production company. Isaac is also […]",Borys Kit,https://www.hollywoodreporter.com/movies/movie-news/kristen-stewart-oscar-isaac-vampire-thriller-flesh-of-the-gods-1235888602/,https://www.hollywoodreporter.com/wp-content/uploads/2024/05/Kristen-Stewart-Oscar-Isaac-getty-H-2024.jpg?w=450&h=253&crop=1
Anthony Hopkins to Play George Frideric Handel in Composer Biopic ‘The King of Covent Garden’,"Anthony Hopkins, who has embodied a cast of real-life characters in his long career, ranging from Richard Nixon (in Nixon) and Sigmund Freund (Freud’s Last Session) to Alfred Hitchcock (Hitchcock), and Adolf Hitler (1981 TV movie The Bunker), is set to play composer George Frideric Handel in the upcoming feature The King of Covent Garden. […]",Scott Roxborough,https://www.hollywoodreporter.com/movies/movie-news/anthony-hopkins-george-frideric-handel-composer-film-the-king-of-covent-garden-1235888507/,https://www.hollywoodreporter.com/wp-content/uploads/2024/05/Hopkins-Handel-and-Jenkins.jpeg?w=450&h=253&crop=1
"Glenn Close, Jeremy Irons Join Retirement Home Comedy ‘Encore’","More than 30 years after Reversal of Fortune, Jeremy Irons and Glenn Close are ready for their Encore. The pair, who faced off as Claus and Sunny von Bülow in the 1990 Oscar-winning thriller, is set to reteam in the upcoming best-agers comedy from British director Simon Curtis (My Week With Marilyn, Downton Abbey: A […]",Scott Roxborough,https://www.hollywoodreporter.com/movies/movie-news/glenn-close-jeremy-irons-don-johnson-henry-winkler-retirement-home-comedy-encore-1235888486/,https://www.hollywoodreporter.com/wp-content/uploads/2024/05/winkler-irons.jpg?w=450&h=253&crop=1
