Title,Description,Author,Link,Image
Oscars: ‘Oppenheimer’ Star Cillian Murphy Dedicates Best Actor Win to “Peacemakers Everywhere”,"Oppenheimer star Cillian Murphy won the best actor Oscar at the 96th Academy Awards on Sunday night, and dedicated his win to the “peacemakers” of the world. “Chris Nolan and Emma Thomas, it’s been the wildest, most exhilarating, most creatively satisfying journey you’ve taken me on over the last 20 years,” Murphy said after taking […]",Beatrice Verhoeven,https://www.hollywoodreporter.com/movies/movie-news/oscars-best-actor-cillian-murphy-oppenheimer-1235848109/,https://www.hollywoodreporter.com/wp-content/uploads/2024/03/Cillian-Murphy-Oscars-Show-Getty-H-2024.jpg?w=450&h=253&crop=1
Oscars: Christopher Nolan Says First Oscar Win for Best Director “Means The World”,"Oppenheimer director Christopher Nolan won the Academy Award for best director, his first Oscar ever, on Sunday night. “I have so many people to thank,” Nolan said during his acceptance speech. “The most incredible cast, Matt Damon, Robert, Emily, Florence, just so many others, all at the top of their game, led by the incredible […]",Beatrice Verhoeven,https://www.hollywoodreporter.com/movies/movie-news/oscars-christopher-nolan-first-win-oppenheimer-1235848106/,https://www.hollywoodreporter.com/wp-content/uploads/2024/03/christopher-nolan-oscars-GettyImages-2066803036-2024.jpg?w=450&h=253&crop=1
"Oscars: ‘Oppenheimer’ Scores Seven Wins Including Best Picture, Actor, Supporting Actor and Director","Oppenheimer was the opposite of a bomb at the 2024 Oscars, winning seven Oscars over the course of the ceremony — including best picture, director, actor, supporting actor, original score, cinematography and film editing. The Universal historical epic scored actors Cillian Murphy and Robert Downey Jr. their first Oscars for best actor and supporting actor, […]",Tyler Coates,https://www.hollywoodreporter.com/movies/movie-news/oscars-2024-recap-highlights-winners-1235848005/,https://www.hollywoodreporter.com/wp-content/uploads/2024/03/Cillian-Murphy-Emma-Stone-Robert-Downey-Jr-and-DaVine-Joy-Randolph-Split-Getty-H-2024.jpg?w=450&h=253&crop=1
Oscars: Full List of Winners,"Oppenheimer was named best picture at the 2024 Oscars, which were were handed out Sunday. The film took a total of seven awards during the night: Christopher Nolan won best director, Cillian Murphy won best actor and Robert Downey Jr. won best supporting actor. The film also won awards for best cinematography, best original score […]",Kimberly Nordyke,https://www.hollywoodreporter.com/movies/movie-news/oscars-2024-winners-list-1235847823/,https://www.hollywoodreporter.com/wp-content/uploads/2024/03/GettyImages-2074663619-copy.jpg?w=450&h=253&crop=1
Messi the Dog Did Indeed Make It to the Oscars,"Messi the Dog, the Anatomy of a Fall star and awards season darling, did, in fact, make an appearance at the 2024 Oscars on Sunday. A source had previously told The Hollywood Reporter that Messi would not be appearing at the Academy Awards after his Los Angeles press tour that saw him attend the Oscars […]",Christy Piña,https://www.hollywoodreporter.com/movies/movie-news/messi-the-dog-attends-2024-oscars-1235848492/,https://www.hollywoodreporter.com/wp-content/uploads/2024/03/messi-the-dog-oscars-GettyImages-2074242777-2024.jpg?w=450&h=253&crop=1
Oscars 2024 Performance: Lily Gladstone Gets Teary Eyed Watching Scott George and the Osage Singers,"Lily Gladstone got teary eyed watching Scott George and the Osage Singers’ powerful performance of “Wahzhazhe (A Song for My People)” from Martin Scorsese’s Killers of the Flower Moon at the 2024 Oscars. The performers joined forces to collectively bang a drum, dressed in traditional Osage attire, as the women sang. George previously shared how […]",Tatiana Tenreyro,https://www.hollywoodreporter.com/movies/movie-news/becky-g-jon-batiste-scott-george-osage-singers-oscars-performance-1235848179/,https://www.hollywoodreporter.com/wp-content/uploads/2024/03/Scott-George-Osage-Singers-Oscars-Show-Getty-H-2024.jpg?w=450&h=253&crop=1
Oscar Viewers Speculate About Emma Stone’s Reaction to Jimmy Kimmel’s ‘Poor Things’ Joke,"Many 2024 Oscar viewers found themselves captivated by speculation about what Emma Stone said to her husband after Jimmy Kimmel joked about the nudity in Poor Things during the awards show on Sunday. Following a montage dedicated to the 11-time nominated film, Oscars host Kimmel quipped to the crowd that, “Those were all the parts […]",Zoe G Phillips,https://www.hollywoodreporter.com/movies/movie-news/emma-stone-jimmy-kimmel-poor-things-joke-2024-oscars-1235848536/,https://www.hollywoodreporter.com/wp-content/uploads/2024/03/emma-stone-oscars-rc-GettyImages-2074446027-2024.jpg?w=450&h=253&crop=1
’20 Days in Mariupol’ Director Calls for End to Russian Invasion in Best Documentary Speech,"20 Days in Mariupol won best documentary at the 2024 Oscars, with director Mstyslav Chernov celebrating what he said is the first Oscar win for Ukraine while also acknowledging his wish to have never made his documentary in the first place. “I am honored but probably I will be the first director on this stage […]",Mia Galuppo,https://www.hollywoodreporter.com/movies/movie-news/20-days-in-mariupol-oscar-best-documentary-1235848191/,https://www.hollywoodreporter.com/wp-content/uploads/2024/03/Mstyslav-Chernov-Oscars-Winner-Onstage-GettyImages-2066800352-H-2024.jpg?w=450&h=253&crop=1
Ryan Gosling Dazzles in “I’m Just Ken” Oscars Performance,"Ryan Gosling and Mark Ronson took the stage at the Oscars 2024 to perform their Barbie hit “I’m Just Ken.” Gosling kicked off the performance from his seat in the audience behind co-star Margot Robbie, decked out in a hot pink, bedazzled custom Gucci suit, matching leather gloves and Gucci sunglasses. Gosling was joined by […]",Christy Piña,https://www.hollywoodreporter.com/movies/movie-news/ryan-gosling-oscars-2024-performance-im-just-ken-1235847152/,https://www.hollywoodreporter.com/wp-content/uploads/2024/03/Ryan-Gosling-Im-Just-Ken-Performance-GettyImages-2066801715-H-2024.jpg?w=450&h=253&crop=1
"Jimmy Kimmel Continues Oscars Snacks Tradition, Gifts Attendees With Shappy Pretzel and Candy","While Jimmy Kimmel hosted the 2024 Oscars, his fourth time as the emcee, the late-night host made sure to continue a ceremony tradition: Provide snacks. Ahead of the ceremony, A-list stars and others in attendance were greeted with snack boxes placed under each seat inside the Dolby Theatre. Inside the boxes were Shappy Pretzel and […]",Lexy Perez,https://www.hollywoodreporter.com/movies/movie-news/oscars-2024-audience-food-shappy-pretzel-mike-ike-1235847102/,https://www.hollywoodreporter.com/wp-content/uploads/2024/03/Jimmy-Kimmel-Oscar-Host-Onstage-GettyImages-2074488674-H-2024.jpg?w=450&h=253&crop=1
John Cena Goes Nearly Nude While Presenting at the Oscars,"John Cena may have not run across the 2024 Oscars stage nude Sunday, but he certainly did awkwardly walk to present the award for best costume design. Jimmy Kimmel initially kicked off the bit by asking, “Can you imagine if a nude man ran across the stage today? Wouldn’t that be crazy?” The host was […]",Carly Thomas,https://www.hollywoodreporter.com/movies/movie-news/john-cena-nude-present-oscars-2024-1235848370/,https://www.hollywoodreporter.com/wp-content/uploads/2024/03/GettyImages-2066798189-copy.jpg?w=450&h=253&crop=1
Robert Downey Jr. Thanks Entertainment Attorney for “Bailing Me Out” As He Wins Oscar,"Robert Downey Jr. has traded an iron suit for Oscar gold. The actor took home best supporting actor at the Oscars 2024 for his work as in Oppenheimer as Lewis Strauss, with the win marking a high point in a career full of dramatic twists and turns. “I’d like to thank my terrible childhood and […]",Aaron Couch,https://www.hollywoodreporter.com/movies/movie-news/robert-downey-jr-wins-oscar-supporting-actor-oppenheimer-1235848171/,https://www.hollywoodreporter.com/wp-content/uploads/2024/03/Robert-Downey-Jr-GettyImages-2066799273-2024.jpg?w=450&h=253&crop=1
Filmart: Veteran Chinese Content Producers Launch Production Banner S11 Partners,"Veteran Chinese-language content producers Cora Yim and Benjamin Lin have joined forces to launch a new production company named S11 Partners, based in Hong Kong and Taiwan. The outfit aims to develop, finance, produce and distribute original, market-driven Chinese-language content for global audiences. Its equity investors include Medialink Group, the Hong Kong stock market-listed IP […]",Patrick Brzeski,https://www.hollywoodreporter.com/movies/movie-news/filmart-2024-launch-s11-partners-1235847617/,https://www.hollywoodreporter.com/wp-content/uploads/2024/03/Photo-3_S11-Partners-founders-Benjamin-Lin-left-and-Cora-Yim-right_photo-credit-Mirror-Weekly-1.jpg?w=450&h=253&crop=1
‘The Zone of Interest’ Director Makes Gaza Statement in Oscars Speech,"The Zone of Interest, the German-language Holocaust drama directed by Jonathan Glazer and starring Christian Friedel and Sandra Hüller, has won the United Kingdom its first-ever Academy Award for best international feature at the Oscars 2024. In his speech for his Cannes Grand Prix-winner, Glazer linked the film’s subject to the ongoing conflict in Gaza, […]","Kevin Dolak, Georg Szalai",https://www.hollywoodreporter.com/movies/movie-news/oscars-2024-the-zone-of-interest-uk-first-international-feature-award-win-gaza-statement-1235839564/,https://www.hollywoodreporter.com/wp-content/uploads/2024/03/GettyImages-2074802522-1.jpg?w=450&h=253&crop=1
Billie Eilish Delivers Heartfelt Performance of “What Was I Made For?” at the Oscars,"Billie Eilish pulled on audience heartstrings while performing her hit song from the Barbie soundtrack, “What Was I Made For?” during the 2024 Oscars. Wearing a Thom Browne tweed blazer and a long black skirt — similar to her red carpet look — Eilish sang the emotional lyrics as Finneas played the piano with an […]",Carly Thomas,https://www.hollywoodreporter.com/movies/movie-news/billie-eilish-oscars-2024-performance-what-was-i-made-for-1235847334/,https://www.hollywoodreporter.com/wp-content/uploads/2024/03/Billie-Eilish-Oscars-Show-Getty-H-2024.jpg?w=450&h=253&crop=1
Jimmy Kimmel Says “We Will Stand With You” to IATSE Members Amid Strike Threat at Oscars 2024,"During the telecast for the 2024 Oscars ceremony, host Jimmy Kimmel, in his opening monologue, addressed the current IATSE contract negotiations and the possibility of an impending strike, telling below-the-line workers: “Know that in your upcoming negotiations we will stand with you.” After feting the nominees at the top of the awards show, Kimmel turned […]",Mia Galuppo,https://www.hollywoodreporter.com/movies/movie-news/jimmy-kimmel-action-iatse-strike-threat-support-oscars-2024-1235847212/,https://www.hollywoodreporter.com/wp-content/uploads/2024/03/GettyImages-2066795995-copy.jpg?w=450&h=253&crop=1
Da’Vine Joy Randolph Thanks Her Publicist in Oscars Acceptance Speech,"Da’Vine Joy Randolph is now an Oscar winner. By Sunday night, this result was mostly a foregone conclusion, as she had already swept best supporting actress at the BAFTA, Critics Choice, Independent Spirit, Golden Globe and Screen Actors Guild awards this season for her performance in Alexander Payne’s throwback dramedy The Holdovers. Randolph played cafeteria […]",Rebecca Sun,https://www.hollywoodreporter.com/movies/movie-news/davine-joy-randolph-oscar-best-supporting-actress-1235848205/,https://www.hollywoodreporter.com/wp-content/uploads/2024/03/DaVine-Joy-Randolph-Oscars-Show-Getty-H-2024.jpg?w=450&h=253&crop=1
Oscars: Jimmy Kimmel Calls Out Greta Gerwig ‘Barbie’ Directing Snub,"During his monologue for the 2024 Oscars, host Jimmy Kimmel was quick to call out the Film Academy for failing to nominate Greta Gerwig for Barbie. “It was a hard year but it was also a great year for movies despite the fact that everything stopped,” Kimmel reflected, alluding to the 2023 actors and writers […]",Lexy Perez,https://www.hollywoodreporter.com/movies/movie-news/jimmy-kimmel-greta-gerwig-barbie-snub-oscars-2024-monologue-1235846937/,https://www.hollywoodreporter.com/wp-content/uploads/2024/03/GettyImages-2066794649-copy.jpg?w=450&h=253&crop=1
Filmart: New Genre Initiative Taps into CAA Connections,"A new funding initiative is being launched at this year’s Hong Kong International Film and TV Market (Filmart) that leans on the commercial nous of Creative Artists Agency (CAA) to help guide the fortunes of emerging Chinese-language filmmakers. Labeled the HKIFF Industry-CAA China Genre Initiative, or HCC, this collaboration between the Hong Kong International Film […]",Mathew Scott,https://www.hollywoodreporter.com/movies/movie-news/filmart-2024-genre-initiative-caa-1235846388/,https://www.hollywoodreporter.com/wp-content/uploads/2024/03/thumbnail_WIP_TheWindIsUnstoppable_Teaser-Image-2-1.jpg?w=450&h=253&crop=1
"Filmart: Nick Cheuk Talks Grief, Creativity and Hong Kong Cinema","Nick Cheuk’s debut feature was a small film about a very big topic. For Time Still Turns the Page, the Hong Kong director trained his focus on the issue of youth suicide, one that directly affected the filmmaker 14 years ago, when a friend at university died by suicide. It’s a film that comes fraught […]",Mathew Scott,https://www.hollywoodreporter.com/movies/movie-news/filmart-nick-cheuk-hong-kong-cinema-1235846331/,https://www.hollywoodreporter.com/wp-content/uploads/2024/03/Best-New-Director_Nick-Cheuk-1.jpg?w=450&h=253&crop=1
‘We Can Be Heroes’ Review: A Big-Hearted Celebration of LARP-ing Teens,Carina Mia Wong and Alex Simmons' SXSW-premiering documentary follows kids at a live action role-playing summer camp in upstate New York.,Daniel Fienberg,https://www.hollywoodreporter.com/movies/movie-reviews/we-can-be-heroes-review-1235847508/,https://www.hollywoodreporter.com/wp-content/uploads/2024/03/we-can-be-heroes-286354-copy.jpg?w=450&h=253&crop=1
"‘Y2K’ Review: Rachel Zegler in a Sci-Fi Comedy That Offers Lots of ’90s Nostalgia, but Not Much Else","In Kyle Mooney's directorial debut, a group of teens endeavor to save the world from sentient machines.",Lovia Gyarkye,https://www.hollywoodreporter.com/movies/movie-reviews/y2k-review-rachel-zegler-kyle-mooney-1235847713/,https://www.hollywoodreporter.com/wp-content/uploads/2024/03/y2k-290239-copy.jpg?w=450&h=253&crop=1
"‘Grand Theft Hamlet’ Review: When Shakespeare Meets Gaming, Hilarity and Heartbreak Ensue",The doc follows a pair of out-of-work theater actors who try to stage a production of 'Hamlet' within the video game 'Grand Theft Auto' during the COVID lockdown of 2021.,Leslie Felperin,https://www.hollywoodreporter.com/movies/movie-reviews/grand-theft-hamlet-review-1235846517/,https://www.hollywoodreporter.com/wp-content/uploads/2024/03/grand-theft-hamlet-286259-copy.jpg?w=450&h=253&crop=1
Was the Oscar Statuette Modeled and Named After Ancient Egyptian Gods?,"On Sunday night, for the 96th time, the Academy of Motion Picture Arts and Sciences will hand out Academy Award statuettes, which many have referred to since the early 1930s, and the Academy itself has described since 1939, as “Oscars.” The Academy has long asserted that these shiny gold figurines — which are now the […]",Scott Feinberg,https://www.hollywoodreporter.com/movies/movie-news/oscar-statuette-modeled-named-after-ancient-egyptian-gods-1235847398/,https://www.hollywoodreporter.com/wp-content/uploads/2024/03/Gold-statue-of-Ptah-God-Oscars-Oscar-statue-getty-H-2024.jpg?w=450&h=253&crop=1
Hollywood Flashback: Will Rogers Was the First (and Only) Native American Oscar Host,"By the time Will Rogers was roped into serving as emcee for the sixth Academy Awards, he was a celebrated performer who had appeared in more than 30 features and was on his way to becoming the No. 1 box office star of 1934, topping the likes of Clark Gable and Shirley Temple. Having honed his wit […]",Angela Aleiss,https://www.hollywoodreporter.com/movies/movie-news/will-rogers-native-oscar-host-1235843630/,https://www.hollywoodreporter.com/wp-content/uploads/2024/03/1086_11310_1932-H-2024.jpg?w=450&h=253&crop=1
‘Super Mario Bros. Movie’ Announces Sequel Set for 2026 With Same Directors,"The Super Marios Bros Movie will return with a sequel, Nintendo announced on Sunday. The film, set for release on April 3, 2026, will come almost exactly three years after the release of the original movie. Nintendo game director Shigeru Miyamoto and Illumination’s Chris Meledandri announced the news during a Mario Day video, celebrated annually […]",Zoe G Phillips,https://www.hollywoodreporter.com/movies/movie-news/super-mario-bros-movie-sequel-2026-1235847755/,https://www.hollywoodreporter.com/wp-content/uploads/2024/03/SuperMariosMCDSUMA_UV017.jpg?w=450&h=253&crop=1
‘Desert Road’ Review: Kristine Froseth Stars in a Spellbinding and Rewardingly Disorienting Head Trip,Writer-director Shannon Triplett’s feature debut revolves around a lone traveler caught in a seemingly endless spiral after an accident in the Mojave.,Sheri Linden,https://www.hollywoodreporter.com/movies/movie-reviews/desert-road-review-kristine-froseth-1235844689/,https://www.hollywoodreporter.com/wp-content/uploads/2024/03/desert-road-284427-copy.jpg?w=450&h=253&crop=1
‘Babes’ Review: Ilana Glazer and Michelle Buteau Shine in Pamela Adlon’s Charming Maternal Romp,The comedians play best friends navigating pregnancy in the 'Better Things' creator's feature directorial debut.,Lovia Gyarkye,https://www.hollywoodreporter.com/movies/movie-reviews/babes-review-ilana-glazer-michelle-buteau-pamela-adlon-1235847625/,https://www.hollywoodreporter.com/wp-content/uploads/2024/03/babes-290153-copy.jpg?w=450&h=253&crop=1
Asia Film Awards: Ryusuke Hamaguchi’s ‘Evil Does Not Exist’ Wins Best Film,"Oscar winner Ryusuke Hamaguchi’s formalist arthouse drama Evil Does Not Exist won the best film prize Sunday night at the Asia Film Awards in Hong Kong. The Japanese film industry had a big night overall at the 17th edition of the awards ceremony, which was hosted this year in Hong Kong’s gleaming new Xiqu Centre, […]",Patrick Brzeski,https://www.hollywoodreporter.com/movies/movie-news/asia-film-awards-2024-winners-1235846437/,https://www.hollywoodreporter.com/wp-content/uploads/2023/08/AKU-WA-SONZAI-SHINAI-EVIL-DOES-NOT-EXIST-Official-still-Credits-2023-NEOPA-Fictive.jpg?w=450&h=253&crop=1
Michael Keaton Says He’s Seen a Cut of ‘Beetlejuice’ Sequel: “It’s Just So Fun”,"Michael Keaton revealed he saw a cut of the Beetlejuice sequel, adding that he can “confidently say this thing is great.” The actor reprised his role as Beetlejuice for the upcoming movie, nearly four decades after playing the character in the 1988 Tim Burton-directed movie. Burton also returned to direct Beetlejuice Beetlejuice. During a recent interview […]",Carly Thomas,https://www.hollywoodreporter.com/movies/movie-news/michael-keaton-seen-beetlejuice-sequel-cut-1235847542/,https://www.hollywoodreporter.com/wp-content/uploads/2024/03/Michael-Keaton-getty-H-2024.jpg?w=450&h=253&crop=1
‘Azrael’ Review: Samara Weaving in a High-Concept Horror Flick That’s Frighteningly Familiar,The 'Ready or Not' star plays a girl on the run from flesh-eating monsters in a wordless genre offering from director E.L. Katz and writer Simon Barrett.,Jordan Mintzer,https://www.hollywoodreporter.com/movies/movie-reviews/azrael-review-samara-weaving-1235846576/,https://www.hollywoodreporter.com/wp-content/uploads/2023/09/Azrael-FIRST-LOOK-Berlin80-H-2023.jpg?w=450&h=253&crop=1
"‘MoviePass, MovieCrash’ Review: HBO Doc Is an Effectively Nostalgic Communal Wake for Film Fans","Muta'Ali's documentary looks back at what went right and then very wrong with the innovative, doomed service.",Daniel Fienberg,https://www.hollywoodreporter.com/movies/movie-reviews/moviepass-moviecrash-review-hbo-1235847421/,https://www.hollywoodreporter.com/wp-content/uploads/2024/03/untitled-moviepass-documentary-291374-copy.jpg?w=450&h=253&crop=1
‘Magpie’ Review: Daisy Ridley Stars in a Marital Noir That Never Heats Up,The film centers on a stay-at-home mother who is pushed to the brink after her husband falls in love with a famous actress.,Angie Han,https://www.hollywoodreporter.com/movies/movie-reviews/magpie-review-daisy-ridley-1235844603/,https://www.hollywoodreporter.com/wp-content/uploads/2024/03/magpie-290448-H-2024.jpg?w=450&h=253&crop=1
Lily Gladstone Recalls Being “Really Upset” When Cate Blanchett Didn’t Win Oscar for ‘Elizabeth’,"It’s not unknown that Lily Gladstone is a huge fan of Cate Blanchett, but the actress is recalling her reaction when Blanchett missed out on an Oscar for Elizabeth. The Killers of the Flower Moon star recently told People magazine that she was disappointed when the Tár actress didn’t win the Academy Award for best […]",Carly Thomas,https://www.hollywoodreporter.com/movies/movie-news/lily-gladstone-upset-cate-blanchett-didnt-win-oscar-elizabeth-1235847485/,https://www.hollywoodreporter.com/wp-content/uploads/2024/03/Lily-Gladstone-Cate-Blanchett-getty-H-2024.jpg?w=450&h=253&crop=1
How 11-Time Oscar Nominee ‘Poor Things’ Got Rich at the Global Box Office,"When deciding whether make Greek filmmaker Yorgos Lanthimos’ Poor Things, Searchlight Pictures and parent company Disney believed the movie would be able to earn north of $100 at the global box office. After all, the project was reuniting Lanthimos with Emma Stone, one of Hollywood’s on-fire actresses who had starred in the filmmaker’s Oscar-nominated The […]",Pamela McClintock,https://www.hollywoodreporter.com/movies/movie-news/how-poor-things-got-rich-at-the-global-box-office-1235847481/,https://www.hollywoodreporter.com/wp-content/uploads/2024/03/Emma-Stone-Poor-Things-Publicity-H-2024.jpg?w=450&h=253&crop=1
‘My Dead Friend Zoe’ Review: Sonequa Martin-Green and Ed Harris in an Intimate but Erratic Veteran Drama,A U.S. Afghanistan vet navigates life after war and caring for her grandfather in this directorial debut by Kyle Hausmann-Stokes and produced by Travis Kelce.,Lovia Gyarkye,https://www.hollywoodreporter.com/movies/movie-reviews/my-dead-friend-zoe-review-1235845142/,https://www.hollywoodreporter.com/wp-content/uploads/2024/03/my-dead-friend-zoe-283924-H-2024.jpg?w=450&h=253&crop=1
‘Bob Trevino Likes It’ Review: Barbie Ferreira and John Leguizamo Earn Your Tears in a Touching Dramedy of Connection,A lonely young woman befriends a childless older man while searching on Facebook for her estranged father in Tracie Laymon's SXSW competition entry.,Angie Han,https://www.hollywoodreporter.com/movies/movie-reviews/bob-trevino-likes-it-review-barbie-ferreira-john-leguizamo-1235842217/,https://www.hollywoodreporter.com/wp-content/uploads/2024/03/bob-trevino-likes-it-287150-copy.jpg?w=450&h=253&crop=1
Everything to Know About the 2024 Oscars,"The 2024 Oscars will be held on Sunday, March 10 at the Dolby Theatre at Ovation Hollywood in Los Angeles. Jimmy Kimmel returns as host for the fourth time, joined onstage by an all-star list of presenters. Kimmel previously said he returned to emcee the show partly because he had a feeling a popular movie […]",Tatiana Tenreyro,https://www.hollywoodreporter.com/movies/movie-features/oscars-2024-guide-presenters-nominees-start-time-1235842357/,https://www.hollywoodreporter.com/wp-content/uploads/2023/10/Oscar-Statuettes-Academy-Awards-GettyImages-1205157220-H-2023.jpg?w=450&h=253&crop=1
‘The Holdovers’ Accused of Plagiarism by ‘Luca’ Writer,"The Alexander Payne awards contender The Holdovers is facing controversy on the eve of the Oscars, where the script from David Hemingson is nominated for best original screenplay. The feature stars Paul Giamatti as a cynical teacher at a boarding school who gets stuck caring for a teenage boy (Dominic Sessa) over Christmas break. According […]","Aaron Couch, Christy Piña",https://www.hollywoodreporter.com/movies/movie-news/the-holdovers-accused-of-plagiarism-1235847436/,https://www.hollywoodreporter.com/wp-content/uploads/2023/07/the-holdovers-HOLDOVERS_FP_00406_R_rgb.jpg?w=450&h=253&crop=1
Miriam Margolyes Says She Worries About Harry Potter Fans Because “They Should Be Over That by Now”,"Harry Potter actress Miriam Margolyes has some thoughts about the people who are still superfans of the famous film franchise. During an interview with New Zealand’s 1News network, Margolyes was asked how Harry Potter and Blackadder fans approach her differently when they see her in public. She explained that fans of the British sitcom that […]",Christy Piña,https://www.hollywoodreporter.com/movies/movie-news/miriam-margolyes-harry-potter-fans-should-be-over-it-1235847400/,https://www.hollywoodreporter.com/wp-content/uploads/2024/03/Miriam-Margolyes-Getty-H-2024.jpg?w=450&h=253&crop=1
What Time Are the 2024 Oscars?,"The 2024 Oscars are getting an early start. The 96th annual Academy Awards, set to air Sunday, March 10, will air on ABC in the U.S. starting at 7 p.m. ET/4 p.m. PT, following a half-hour ABC preshow that starts at 6:30 p.m. ET/3:30 p.m. PT. Those who want to watch the Oscars online can […]",Tatiana Tenreyro,https://www.hollywoodreporter.com/movies/movie-news/2024-oscars-start-time-1235846737/,https://www.hollywoodreporter.com/wp-content/uploads/2024/01/GettyImages-1473097817-H-2024.jpg?w=450&h=253&crop=1
