Title,Description,Author,Link,Image
‘Loki’ Actress Wunmi Mosaku Joins Michael B. Jordan in Ryan Coogler’s Untitled Supernatural Thriller (Exclusive),"Wunmi Mosaku, best known for her work in Marvel Studios’ Loki and HBO’s Lovecraft Country, has joined Michael B. Jordan in the untitled supernatural horror thriller that Ryan Coogler is directing for Warner Bros. The buzzy project, the object of a high-profile bidding war in January, heads before cameras later this month in New Orleans and […]",Borys Kit,https://www.hollywoodreporter.com/movies/movie-news/wunmi-mosaku-michael-b-jordan-ryan-coogler-supernatural-movie-1235869053/,https://www.hollywoodreporter.com/wp-content/uploads/2024/04/Wunmi-Mosaku-and-Michael-B-Jordan-Split-Getty-H-2024.jpg?w=450&h=253&crop=1
"All Six of ‘The Omen’ Movies, Ranked","The Omen was never conceived with the intention of spawning a franchise and yet it has remained one of Hollywood’s most enduring horror properties. The original theatrical trilogy ended in the early ’80s, when religious horror gave way to slasher film. But in five short years, The Omen had cemented a legacy within pop culture. […]",Richard Newby,https://www.hollywoodreporter.com/lists/the-omen-movies-ranked/,https://www.hollywoodreporter.com/wp-content/uploads/2024/04/The-First-Omen-MCDFIOM_H3009-H-2024.jpg?w=450&h=253&crop=1
Geena Davis Set to Receive Viola Davis Trailblazer Award at CinemaCon,"CinemaCon kicks off today in Las Vegas, and as the official convention of the National Association of Theater Owners gets underway, organizers have added another honoree to the roster: Geena Davis. The Oscar winner will be feted with the Viola Davis Trailblazer Award during the Big Screen Achievement Awards inside the Colosseum at Caesars Palace […]",Chris Gardner,https://www.hollywoodreporter.com/movies/movie-news/geena-davis-viola-davis-trailblazer-award-cinemacon-1235868952/,https://www.hollywoodreporter.com/wp-content/uploads/2024/04/Geena-Davis_2024-Viola-Davis-Trailblazer-Award-H-2024.jpg?w=450&h=253&crop=1
Netflix Film Division Undergoes Genre-Based Reorg (Exclusive),"Netflix’s film division is getting a reorg under new head Dan Lin. Several sources tell The Hollywood Reporter that the features division at the streaming service will now be split up by genre — such as sci-fi, rom-com and faith-based. While Lin officially started his Netflix tenure April 1, sources note that the reorg has […]","Mia Galuppo, Borys Kit",https://www.hollywoodreporter.com/movies/movie-news/netflix-film-division-undergoes-genre-based-re-org-1235867851/,https://www.hollywoodreporter.com/wp-content/uploads/2022/07/TGM_SU_20210716_06611rv2-H-2022.jpg?w=450&h=253&crop=1
20th Century Lands Bruce Springsteen Movie to Star Jeremy Allen White,"20th Century and Disney has landed Deliver Me From Nowhere, the Bruce Springsteen project that has Jeremy Allen White in talks to star as the Boss. Scott Cooper, who treaded into music territory with his debut Crazy Heart, will write and direct the feature that will be based on the 2023 book Deliver Me from […]",Borys Kit,https://www.hollywoodreporter.com/movies/movie-news/bruce-springsteen-movie-jeremy-allen-white-1235868732/,https://www.hollywoodreporter.com/wp-content/uploads/2024/04/Scott-Cooper-Bruce-Springsteen-Jeremy-Allen-White-Split-Getty-H-2024.jpg?w=450&h=253&crop=1
‘Pulp Fiction’ Stars Reuniting at TCM Classic Film Festival (Exclusive),"Opening night of the TCM Classic Film Festival next week will also serve as a Pulp Fiction reunion. Uma Thurman, Samuel L. Jackson, Rosanna Arquette and Harvey Keitel are among those joining John Travolta on April 18 for the 30th anniversary, 35mm screening of Quentin Tarantino’s Pulp Fiction (1994) at the TCL Chinese Theatre in […]",Mike Barnes,https://www.hollywoodreporter.com/movies/movie-news/tcm-classic-film-festival-pulp-fiction-reunion-1235868020/,https://www.hollywoodreporter.com/wp-content/uploads/2024/04/Uma-Thurman-Samuel-L.-Jackson-Rosanna-Arquette-and-Harvey-Keitel.jpg?w=450&h=253&crop=1
Kevin Costner Western ‘Horizon’ Set for Cannes Debut,"Kevin Costner is moseying his way onto the Croisette. Costner’s highly anticipated western Horizon: An American Saga will screen out of competition at the Cannes Film Festival. The film will screen Sunday, May 19, 2024, at the fest, joining already announced titles that include the Mad Max film Furiosa. “I’d like to thank the Festival […]",Mia Galuppo,https://www.hollywoodreporter.com/movies/movie-news/kevin-costner-western-horizon-cannes-1235868719/,https://www.hollywoodreporter.com/wp-content/uploads/2024/02/HRZN-TRL-012-H-2024.jpg?w=450&h=253&crop=1
"Robert Downey Jr. Says He’d “Happily” Return as Iron Man, Regularly Threw Out His Dialogue","Robert Downey Jr. may have recently won his first Oscar for Oppenheimer, but he’s not looking to run from his Marvel past. In fact, the actor says he’d “happily” return as Tony Stark/Iron Man. “It’s too integral a part of my DNA,” Downey told Esquire in a new interview. “That role chose me. And look, […]",James Hibberd,https://www.hollywoodreporter.com/movies/movie-news/robert-downey-jr-iron-man-marvel-return-1235868651/,https://www.hollywoodreporter.com/wp-content/uploads/2024/01/MCDIRMA_EC118-H-2024.jpg?w=450&h=253&crop=1
"Spike Lee, Paul Mescal and Annie Lennox Join Cinema For Gaza Auction","New film celebrities have joined the Cinema for Gaza auction that is raising funds for the charity Medical Aid for Palestinians (MAP). The latest auction lots include a signed and framed Malcolm X poster offered by Spike Lee and Paul Mescal donating a signed Aftersun poster. On the experiences side, actress Tessa Thompson is offering to have […]",Etan Vlessing,https://www.hollywoodreporter.com/movies/movie-news/spike-lee-paul-mescal-annie-lennox-cinema-gaza-auction-1235868527/,https://www.hollywoodreporter.com/wp-content/uploads/2023/01/Spike-Lee-2023.-Photo-credit-Marc-Baptiste-copy.jpg?w=450&h=253&crop=1
Scarlett Johansson and Channing Tatum Blast Off in ‘Fly Me to the Moon’ Trailer,"Scarlett Johansson and Channing Tatum find themselves in each other’s orbit in the first trailer for Fly Me to the Moon. Apple Original Films’ romantic comedy feature from director Greg Berlanti hits theaters July 14, with Sony handling distribution. Jim Rash, Ray Romano and Woody Harrelson round out the cast for the film that takes […]",Ryan Gajewski,https://www.hollywoodreporter.com/movies/movie-news/fly-me-to-the-moon-trailer-scarlett-johansson-channing-tatum-1235867866/,https://www.hollywoodreporter.com/wp-content/uploads/2024/04/0473_Eleven_Feature_DM_05781_r-H-2024.jpg?w=450&h=253&crop=1
Mia Goth Heads to Hollywood in A24’s ‘Maxxxine’ Trailer,"Look out Hollywood! Maxine Minx has come to town to be a star, and heaven help those who get in her way. Including, presumably, a mysterious killer who has designs on her. A24 has finally dropped the trailer for Maxxxine, the final nail in the proverbial coffin of its hit and acclaimed X horror trilogy […]",Borys Kit,https://www.hollywoodreporter.com/movies/movie-news/mia-goth-a24-maxxxine-trailer-1235868300/,https://www.hollywoodreporter.com/wp-content/uploads/2024/04/A24_MaXXXine_FirstLook_Confidential.jpg?w=450&h=253&crop=1
China Box Office: Hayao Miyazaki’s ‘The Boy and The Heron’ Soars to $73M Over Holiday Weekend,Japanese anime master Hayao Miyazaki is revered in China as much as he is anywhere. The 83-year-old filmmaker’s Oscar-winning swan song The Boy and the Heron opened last Wednesday in China to take advantage of the country’s Qingming public holiday and by Sunday it had earned $73 million — more than its totals in both […],Patrick Brzeski,https://www.hollywoodreporter.com/movies/movie-news/china-box-office-boy-and-the-heron-1235868319/,https://www.hollywoodreporter.com/wp-content/uploads/2023/09/theboyandtheheron_06-H-2023.jpg?w=450&h=253&crop=1
"2024 Global Box Office Forecast Up Slightly, Still Below Last Year","Things are looking slightly better than expected. Timed to this year’s CinemaCon, analytics firm Gower Street released an updated forecast for the global box office that predicts revenues will be stronger than originally expected for 2024. Gower Street is projecting theatrical revenues this year will hit $32.3 billion, up from the $31.5 billion they originally […]",Scott Roxborough,https://www.hollywoodreporter.com/movies/movie-news/2024-global-box-office-forecast-up-slightly-still-bad-1235868201/,https://www.hollywoodreporter.com/wp-content/uploads/2024/02/rev-1-DUN2-T3-0084r_High_Res_JPEG-copy.jpg?w=450&h=253&crop=1
Box Office: ‘Godzilla x Kong’ Squashes ‘Monkey Man’ and ‘First Omen’ With $31.7M,"Godzilla x Kong: The New Empire were the monsters with the mostest at the box office this weekend, as Dev Patel‘s much buzzed-about feature directorial debut Monkey Man and supernatural franchise installment The First Omen both opened behind expectations. Neither genre film ever had a chance of taking away the No. 1 spot from Warner […]",Pamela McClintock,https://www.hollywoodreporter.com/movies/movie-news/monkey-man-box-office-opening-first-omen-1235868004/,https://www.hollywoodreporter.com/wp-content/uploads/2024/03/rev-1-GXK-FP-001rv3_High_Res_JPEG-H-2024.jpg?w=450&h=253&crop=1
Woody Allen on Why He Feels the “Romance of Filmmaking Is Gone”,"Woody Allen isn’t exactly sure what he wants to do next in the movie industry, as he feels “all the romance of filmmaking is gone.” In an interview with AirMail, published online Saturday, the director was asked about his latest film Coup de Chance, his 50th feature, and the delay it faced for release in […]",Carly Thomas,https://www.hollywoodreporter.com/movies/movie-news/woody-allen-romance-of-filmmaking-gone-1235868148/,https://www.hollywoodreporter.com/wp-content/uploads/2024/04/Woody-Allen-getty-H-2024.jpg?w=450&h=253&crop=1
"Bradley Cooper Almost Quit ‘The Place Beyond the Pines’ After Script Rewrite, Director Says","The Place Beyond the Pines director Derek Cianfrance revealed that Bradley Cooper nearly quit the 2013 film after receiving a rewritten script. The filmmaker, who also co-wrote the crime drama starring Ryan Gosling and Eva Mendes, recently told IndieWire at the New Directors/New Films festival that he brought in screenwriter Darius Marder to rewrite “every word” […]",Carly Thomas,https://www.hollywoodreporter.com/movies/movie-news/bradley-cooper-almost-quit-place-beyond-the-pines-derek-cianfrance-1235868137/,https://www.hollywoodreporter.com/wp-content/uploads/2024/04/Place-Beyond-the-Pines-everett-H-2024.jpg?w=450&h=253&crop=1
Lewis Hamilton Says He Regrets Turning Down Role in ‘Top Gun: Maverick’,Racing superstar Lewis Hamilton is opening up about the time he passed on an opportunity to work with Tom Cruise that he still regrets today. The Formula One driver revealed in a recent interview with GQ magazine that he befriended Cruise after the actor invited him to the set of his 2014 film Edge of Tomorrow. The […],Carly Thomas,https://www.hollywoodreporter.com/movies/movie-news/lewis-hamilton-regrets-turning-down-role-top-gun-maverick-1235868129/,https://www.hollywoodreporter.com/wp-content/uploads/2024/04/Lewis-Hamilton-getty-H-2024.jpg?w=450&h=253&crop=1
"David Barrington Holt, Former Head of Jim Henson’s Creature Shop in L.A., Dies at 78","David Barrington Holt, who established and ran the first Creature Shop on the West Coast for The Jim Henson Company during his two-plus decades with the firm, has died. He was 78. Holt died March 13 of complications from cancer at his home in Los Angeles, his son, Chris Holt, announced. Holt started out with […]",Mike Barnes,https://www.hollywoodreporter.com/movies/movie-news/david-barrington-holt-dead-jim-henson-creature-shop-1235868002/,https://www.hollywoodreporter.com/wp-content/uploads/2024/04/David-Barrington-Holt-obit-Publicity-H-2024.jpg?w=450&h=253&crop=1
Carla Gugino Says She Has “PTSD” From Working With Sexist Directors,"While opening up about her decades-long career, Carla Gugino shared that she still has “a little PTSD” from being ignored by male directors on sets because she’s a woman. During a recent conversation with Game of Thrones star Lena Headey for Interview magazine, the Gerald’s Game actress recalled some of her past experiences with directors. […]",Carly Thomas,https://www.hollywoodreporter.com/movies/movie-news/carla-gugino-ptsd-sexist-directors-1235867966/,https://www.hollywoodreporter.com/wp-content/uploads/2024/04/Carla-Gugino-getty-H-2024.jpg?w=450&h=253&crop=1
‘Wicked’ Director Jon M. Chu to Be Honored at CinemaCon Luncheon With Cultural Impact Award,"One year after Universal Pictures debuted the first look at footage from his upcoming two-part musical Wicked at CinemaCon, Jon M. Chu is heading back to Las Vegas for the National Association of Theater Owners’ official convention. Chu will be the guest of honor at an annual filmmaker luncheon during which he will receive a […]",Chris Gardner,https://www.hollywoodreporter.com/movies/movie-news/wicked-jon-m-chu-cinemacon-footage-luncheon-award-1235867860/,https://www.hollywoodreporter.com/wp-content/uploads/2024/04/GettyImages-1347599344-copy.jpg?w=450&h=253&crop=1
‘Ghostbusters’ Star Emily Alyn Lind Explains Why Her ‘Frozen Empire’ Character Was Kept Secret,"[This story contains spoilers for Ghostbusters: Frozen Empire.] You’ve got questions and Emily Alyn Lind has answers. In Ghostbusters: Frozen Empire, when Mckenna Grace’s Phoebe Spengler was sidelined by the Ghostbusters’ longtime bureaucratic nemesis, Walter Peck (William Atherton), the young Ghostbusting hero went on an unexpected journey that quickly introduced her to Lind’s surprise character, […]",Brian Davids,https://www.hollywoodreporter.com/movies/movie-features/ghostbusters-emily-alyn-lind-frozen-empire-twist-1235867633/,https://www.hollywoodreporter.com/wp-content/uploads/2024/04/GettyImages-2076717464-copy.jpg?w=450&h=253&crop=1
‘Star Wars’: Beau Willimon to Co-Write James Mangold’s Movie (Exclusive),"Beau Willimon is going from House of Cards to House of Jedi. The playwright and screenwriter has been tapped to work the script for Star Wars: Dawn of the Jedi, Lucasfilm’s feature that is to be directed by James Mangold. Willimon is joining Mangold to write the script for the project that will trace the […]",Borys Kit,https://www.hollywoodreporter.com/movies/movie-news/star-wars-beau-willimon-to-co-write-james-mangolds-movie-exclusive-1235867598/,https://www.hollywoodreporter.com/wp-content/uploads/2024/04/GettyImages-1424146818-copy.jpg?w=450&h=253&crop=1
"Josh Gad to Co-Write Comic Book ‘The Writer,’ Inspired by Jewish Folklore (Exclusive)","Some years ago, Josh Gad received an out of the blue email from Frank Miller, someone whom he had never met. The legendary comic creator behind The Dark Knight Returns and Sin City asked Gad, the stage and screen actor who is also the voice of Olaf in Disney’s Frozen movies, if he would be […]",Borys Kit,https://www.hollywoodreporter.com/movies/movie-news/josh-gad-to-co-write-comic-book-1235866998/,https://www.hollywoodreporter.com/wp-content/uploads/2024/04/Josh-Gad-and-the-Berkowitz-Bros-Split-Publicity-H-2024.jpg?w=450&h=253&crop=1
"Disney Sets ‘Toy Story 5,’ ‘Mandalorian & Grogu’ for 2026, Delays Live-Action ‘Moana’ by a Year","Woody and Buzz have a date to return to theaters. Disney will release Pixar’s Toy Story 5 on June 19, 2026, the studio announced Friday. Disney CEO Bob Iger first announced Toy Story 5 in February 2023, with the sequel an attempt to return to form for the franchise after the disappointing performance of the […]",Aaron Couch,https://www.hollywoodreporter.com/movies/movie-news/disney-sets-toy-story-5-mandalorian-and-grogu-1235867413/,https://www.hollywoodreporter.com/wp-content/uploads/2024/04/MCDTOST_EC146-copy.jpg?w=450&h=253&crop=1
Diane Keaton-Led Ensemble Comedy ‘Summer Camp’ Lands at Roadside for May Theatrical Release,"The ensemble comedy Summer Camp starring Diane Keaton, Kathy Bates and Alfre Woodard is appropriately set to hit theaters just as the weather is warming up. Roadside Attractions announced Friday that it has acquired U.S. distribution rights to the comedy feature from writer-director Castille Landon. Hitting theaters nationwide on May 31, the movie’s cast also […]",Ryan Gajewski,https://www.hollywoodreporter.com/movies/movie-news/summer-camp-release-diane-keaton-kathy-bates-alfre-woodard-1235867416/,https://www.hollywoodreporter.com/wp-content/uploads/2024/04/Summer-Camp-image.jpg?w=450&h=253&crop=1
Drew Barrymore Says Adam Sandler’s ‘Happy Gilmore’ Sequel Is “in Process”,"Drew Barrymore says she got Adam Sandler to confirm that he’s in the process of writing Happy Gilmore 2. Following comments that Christopher McDonald, who played Shooter McGavin in Happy Gilmore, shared in March that Sandler showed him a first draft of the sequel, Barrymore says she went straight to the source and texted her […]",Tatiana Tenreyro,https://www.hollywoodreporter.com/movies/movie-news/adam-sandler-happy-gilmore-sequel-drew-barrymore-1235867291/,https://www.hollywoodreporter.com/wp-content/uploads/2024/04/2789291_0504bc-copy.jpg?w=450&h=253&crop=1
Dwayne Johnson Says He Won’t Endorse Biden Again for President,"You’d think he’d want to walk back Jungle Cruise or Black Adam. Instead, Dwayne “The Rock” Johnson is expressing some regret about his 2020 endorsement for Joe Biden for president and says he won’t endorse any candidate this year. “The endorsement that I made years ago with Biden was one I thought was the best […]",James Hibberd,https://www.hollywoodreporter.com/movies/movie-news/dwayne-the-rock-johnson-drops-biden-endorsement-1235867282/,https://www.hollywoodreporter.com/wp-content/uploads/2024/02/Dwayne-The-Rock-Johnson-NASCAR-Series-GettyImages-2024314737-H-2024.jpg?w=450&h=253&crop=1
Box Office: ‘Monkey Man’ Fights Off ‘First Omen’ in Thursday Night Previews,"Dev Patel‘s highly anticipated feature directorial debut Monkey Man bested 20 Century’s supernatural franchise horror pic The First Omen in Thursday night previews at the domestic box office. Monkey Man earned $1.4 million in previews, compared to $725,000 for The First Omen, a prequel to Richard Donner’s 1976 film. For the full weekend, tracking has […]",Pamela McClintock,https://www.hollywoodreporter.com/movies/movie-news/monkey-man-box-office-previews-first-omen-1235867163/,https://www.hollywoodreporter.com/wp-content/uploads/2024/04/MM152_0090_comp_v028.1425-copy.jpg?w=450&h=253&crop=1
Amy Adams Starrer ‘Nightbitch’ Sets December 2024 Release Only in Theaters,"Amy Adams vehicle Nightbitch, starring Amy Adams, has landed a Dec. 6 release in cinemas, during the heart of awards season. The Searchlight Pictures and Annapurna film was originally intended to debut on Hulu, but will now get a theatrical release. The project is from Marielle Heller, the actress turned filmmaker whose helming credits include […]",Pamela McClintock,https://www.hollywoodreporter.com/movies/movie-news/amy-adams-nightbitch-moive-release-in-theaters-1235867128/,https://www.hollywoodreporter.com/wp-content/uploads/2024/04/AmyAdamsGettyImages-1124822677.jpg?w=450&h=253&crop=1
Cannes Critics’ Week Names Spanish Director Rodrigo Sorogoyen Jury President,"Spanish director Rodrigo Sorogoyen (Stockholm, The Realm, Madre, The Beasts), who was nominated for the best international film honor at Italy’s David Di Donatello Awards, has been named jury president of this year’s Cannes Critics’ Week, the festival sidebar run by the French film critics union that focuses on first and second features from up-and-coming […]","Scott Roxborough, Georg Szalai",https://www.hollywoodreporter.com/movies/movie-news/cannes-critics-week-2024-president-rodrigo-sorogoyen-1235865695/,https://www.hollywoodreporter.com/wp-content/uploads/2023/07/K0A1025-H-2023.jpg?w=450&h=253&crop=1
Hayao Miyazaki’s ‘The Boy and the Heron’ Smashes Box Office Record in China,"Japanese anime master Hayao Miyazaki’s Oscar-winning swan song The Boy and the Heron has taken flight at China’s box office in a major way.  The enigmatic Studio Ghibli hit opened in China on Wednesday and soared to $13.7 million (RMB 99.1 million), nudging aside Warner Bros. and Legendary Entertainment’s prior box office champ Godzilla x […]",Patrick Brzeski,https://www.hollywoodreporter.com/movies/movie-news/hayao-miyazakis-the-boy-and-the-heron-box-office-record-china-1235867148/,https://www.hollywoodreporter.com/wp-content/uploads/2023/09/HERON_img_1-H-2023.jpg?w=450&h=253&crop=1
"Brooke Shields, Miranda Cosgrove Struggle With Wedding Prep in Netflix’s ‘Mother of the Bride’ Trailer","When it comes to last-minute wedding plans going haywire, the exploits of Brooke Shields and Miranda Cosgrove in the first trailer for Netflix’s romantic comedy Mother of the Bride just might take the cake. Mark Waters’ movie debuts on the streamer May 9 and also stars Benjamin Bratt, Chad Michael Murray, Rachael Harris and Sean […]",Ryan Gajewski,https://www.hollywoodreporter.com/movies/movie-news/mother-of-the-bride-trailer-brooke-shields-miranda-cosgrove-netflix-1235866930/,https://www.hollywoodreporter.com/wp-content/uploads/2024/04/Mother-of-the-Bride-Netflix.jpg?w=450&h=253&crop=1
Rebel Wilson Reveals Her Salaries for ‘Pitch Perfect’ and ‘Bridesmaids’,"Rebel Wilson details how Hollywood’s pay scales can increase exponentially in her new memoir, Rebel Rising. The actress and comedian opens up about her salaries for Bridesmaids and the Pitch Perfect trilogy. Wilson writes in the book that she was paid only $3,500 for 2011’s Bridesmaids, which starred Kristen Wiig, Maya Rudolph, Rose Byrne and […]",Zoe G Phillips,https://www.hollywoodreporter.com/movies/movie-news/rebel-wilson-pay-pitch-perfect-bridesmaids-1235866883/,https://www.hollywoodreporter.com/wp-content/uploads/2024/04/Rebel-Wilson-AACTA-Awards-Ceremony-GettyImages-1999864237-H-2024.jpg?w=450&h=253&crop=1
‘Música’ Review: Rudy Mancuso and Camila Mendes in Stylish Coming-of-Age Debut,"A young New Jersey native with synesthesia navigates the turbulence of love, life and puppetry in this splashy romantic comedy streaming on Prime Video.",Lovia Gyarkye,https://www.hollywoodreporter.com/movies/movie-reviews/musica-review-rudy-mancuso-camila-mendes-prime-video-1235866366/,https://www.hollywoodreporter.com/wp-content/uploads/2024/02/MUSICA.jpg?w=450&h=253&crop=1
Michael J. Fox Says He’s Open to Returning to Acting Despite Retirement,"Michael J. Fox may have announced his retirement from acting, but he shared he’s still open to returning to the screen for the right opportunity. The Back to the Future actor recently told Entertainment Tonight that after he was diagnosed with Parkinson’s disease at age 29 in 1991, his goals in life pivoted from his […]",Carly Thomas,https://www.hollywoodreporter.com/movies/movie-news/michael-j-fox-open-return-acting-retirement-1235866731/,https://www.hollywoodreporter.com/wp-content/uploads/2024/04/GettyImages-2134325482-copy.jpg?w=450&h=253&crop=1
Superman’s ‘Action Comics’ No. 1 Sets Record with $6 Million Sale,"Superman has leapt a world record in a single bound. An issue of Action Comic No. 1, which introduced the world to the Kryptonian hero, sold at auction for a record $6 million Thursday, making it the most valuable comic book in the world. It tops an issue of 1939’s Superman No. 1, which sold […]",Aaron Couch,https://www.hollywoodreporter.com/movies/movie-news/superman-action-comics-record-1235866792/,https://www.hollywoodreporter.com/wp-content/uploads/2024/04/action.jpg?w=450&h=253&crop=1
"Olivia Wilde, LuckyChap, Simon Kinberg Teaming to Adapt Rob Liefeld Comic ‘Avengelyne’ (Exclusive)","A high-powered package is coming together to adapt Avengelyne, the ’90s comic book character from Deadpool creator Rob Liefeld. Olivia Wilde, who last helmed the thriller Don’t Worry Darling, is attached to direct what would be a feature adaptation. LuckyChap, the banner run by Margot Robbie, Tom Ackerley and Josey McNamara and which shepherded last […]","Aaron Couch, Borys Kit",https://www.hollywoodreporter.com/movies/movie-news/margot-robbie-olivia-wilde-team-for-avengelyne-1235478292/,https://www.hollywoodreporter.com/wp-content/uploads/2024/04/imon-Kinberg.jpg?w=450&h=253&crop=1
Denis Villeneuve in Talks for Film Based on Nonfiction Book ‘Nuclear War’,"Legendary Entertainment has picked up feature rights to the latest nonfiction title from author Annie Jacobsen as a potential project for filmmaker Denis Villeneuve. The company has optioned Nuclear War: A Scenario, which hit shelves last month and examines the nuclear military establishment. Villeneuve is in talks with Legendary to be involved in the project, […]",Ryan Gajewski,https://www.hollywoodreporter.com/movies/movie-news/denis-villeneuve-legendary-film-nuclear-war-a-scenario-1235866684/,https://www.hollywoodreporter.com/wp-content/uploads/2024/02/Denis-Villeneuve-CinemaCon-Carpet-GettyImages-1485196830-H-2024.jpg?w=450&h=253&crop=1
